url,title,published_at,content,content_chars
https://www.inn.co.il/news/679915,"ראש מועצת רמת נגב מזהיר: רכבת אווירית של הברחת אמל""ח ברחפנים",,"ערוץ 7
ביטחון
ראש מועצת רמת נגב מזהיר: רכבת אווירית של הברחת אמל""ח ברחפנים
עשרות רחפנים נושאים ממצרים לישראל אמל""ח, כולל מאגים, רימונים וטילי לאו. על התופעה ודרכי ההתמודדות מספר ראש מועצת רמת נגב.
2 דקות
ערן דורון, ראש מועצת רמת נגב, מתריע מהברחת אמל""ח דרך רחפנים המגיעים ממצרים. בראיון לערוץ 7 הוא מספר על מה שהפך לחלק כמעט קבוע מהנוף השמיימי של מרחב המועצה שלו ועל התגובות שהוא מקבל לאזהרותיו.
""אנחנו רואים ושומעים עשרות כלי טייס לא מאוישים. זה יכול להיות כטב""מ חות'י, אבל זה בעיקר עשרות רחפנים שמגיעים מהצד המצרי לתוך שטח מדינת ישראל כשבסלסלות הם נושאים כלי נשק. זה יכול להיות מאגים, רובים, רימונים, טילי לאו ובעצם כמעט כל כלי משחית"", אומר דורון וכדי שנבין אילו משקלים יכול לשאת רחפן שכזה הוא מספר שראה גם רחפ שנשא גנרטור במשקל של שישים קילו. ""אנחנו כבר נמצאים בזמן שאולי גם אנשים יוכלו להיות מנוידים באמצעות רחפנים"".
""אנחנו רואים רכבת אווירית, הלוך וחזור, שמביאה אמצעי לחימה וחוזרת ריקה. הבעיה היא שכעבור שעות לא רבות הכלים האלה כבר עוברים ניסוי כלים שאותו אנחנו מרגישים את זה בישובים שלנו שנמצאים במרחק של ארבעים קילומטר מהגבול. כלומר שזה מגיע למרכז שטח המועצה. הם מבצעים ניסוי כלים ואחרי שבדקו שהכלים תקינים מוכרים אותם לארגוני טרור וארגוני פשיעה שבעיניי הם אותו דבר"".
על מנת להבין את היקפי התופעה מספר דורון כי בשבת האחרונה נצפו 26 רחפנים לאורך היום ו""באוגוטסט על פי נתונים שקיבלתי ממקור מסוים, עברו כ-300 רחפנים, כלומר כעשרה ביום. אם בכל יום ניתן להעביר רק ארבעה כלי נשק זה זיווד של חטיבה"".
מול התופעה, אומר דורון, הטיפול צריך להיות בשלושה אפיקים. הראשון הוא ""מיגור התופעה על הגדר באמצעי לוחמה אלקטרונית שיש לצה""ל ולחיל האוויר"", ובהקשר זה הוא משבח את פעילותה של החטיבה המרחבית, חטיבת פארן ואוגדה 80, הפועלות בנחישות ובמאמצים למצוא פתרונות, אם כי הם מתמודדים עם אתגר מורכב שכן שיבוש תנועת הרחפנים נעשה על ידי פגיעה בתדרים אלחוטיים שמניעים ומכוונים אותם, וכאשר פוגעים בתדרים שכאלה המשמעות היא שיבושים גם אצל האזרחים שלנו. הדברים באים לידי ביטוי בשיבושים סלולאריים, בתקלות בהפעלת שערי הישובים או בפעילות הרפת. ""לכן בין הרצון לשמור על שגרת חיי התושבים וחייהם במרחב לבין מציאת הפתרון על הגדר יש פער שצריך לתפור"".
במסגרת המאבק הזה מתנהל מאבק של חתול ועכבר בין צה""ל ויכולותיו לבין מאמצי המברחים. צה""ל משפר את יכולותיו הטכנולוגיות וכעבור זמן מה המבריחים מוצאים את הדרך להתייעל מה שמחייב גם את צה""ל לשפר את יכולותיו וחוזר חלילה.
""הציר השני נמצא באחריות השב""כ והמשטרה. יש מי ששולח את הרחפן ויש מי שמקבל אותו, והשב""כ והמשטרה צריכים לסגור על הארגונים המקבלים. אלו ארגוני פשיעה וטרור במדינת ישראל ובסמכותם של המשטרה והשב""כ לסגור את המעגל. אם לא יהיה כדאי להבריח בגלל ענישה והרתעה, שטף ההברחות ייפסק בהיבט הזה"".
ממשיך דורון אל האפיק השלישי, עליו הוא שם דגש מיוחד, וזהו חיזוק ההתיישבות במרחב: ""אני מצפה שהממשלה תממש את הריבונות באזור פתחת ניצנה, בכך שיביאו אלפי משפחות חדשות למרחב הזה. יש צעירים רבים שרוצים להגיע לכאן ליישב את הנגב. צריך לוודא שנותנים לצעירים הללו סיבות טובות ואפשרויות להתיישב בנגב. אנחנו יודעים שהתיישבות היא פתרון ביטחוני"".
בהקשר זה מציין דורון כי ""משרד ההתיישבות בראשות השרה אורית סטרוק, מקדם החלטה בנושא וצריך להביא את ההחלטה לגמר ולאשר אותה בממשלה ולהביא משפחות רבות לאזור"".
בדבריו מדגיש דורון כי הגורמים הרלוונטיים כולם אינם מתעלמים מהבעיה ומכירים אותה היטב. ""שב""כ נמצא איתי בסיורים, אני בקשר עם הצבא באופן יומיומי וכמעט בכל שעה. לא מנפנפים אותנו. מכירים את הבעיה ומנסים לטפל בה"", הוא מבהיר.",3209
https://www.inn.co.il/news/679919,חוזרים ליוסף הצדיק,,"ערוץ 7
דעות
חוזרים ליוסף הצדיק
25 שנה להפקרת קבר יוסף ולרצח הרב הלל ליברמן הי""ד, שיצא לציון מתוך תחושת שליחות ולא שב. ראש ישיבת 'עוד יוסף חי' מספר על המאבק, הקריאה לממשלה ועל התקווה לשוב לציון בראש השנה - תקווה שטרם התגשמה.
2 דקות
ח' תשרי תשס""א, שבת תשובה. בדיוק לפני עשרים וחמש שנה. ימים קשים עוברים על כל עם ישראל. זה עתה פרצה ""האינתיפאדה השנייה"" - התוצאות האומללות והבוטות של 'הסכמי אוסלו' הארורים, ושל היחס אל חלקי ארץ הקודש כאל ""שטחים כבושים"".
אנשי ישיבת 'עוד יוסף חי' שוהים מחוץ לציונו הקדוש של יוסף הצדיק. עקב ההתראות על המצב - כבר בערב ראש השנה הודיע צה""ל שהתלמידים - ששהו בציון לקראת שהיה בראש השנה - צריכים לצאת מהמקום. בימים שלאחר מכן מתקיימים קרבות עזים, במהלכם - למרבה החרפה - הופקר למוות לוחם מג""ב, מדחת יוסף, שנפצע פציעה ברת טיפול - אך מפקדי צה""ל (ומפקד האוגדה בני גנץ..) מסרבים לפגוע במחבלים ותומכיהם פגיעה קשה כדי להציל את חייו, מעדיפים את חייהם על חייו, והוא מדמם למוות.
איש קבר יוסף, הרב הלל ליברמן הי""ד, מאלון מורה, לא יכול לשאת את החרפה. שנים על גבי שנים היה הרב הלל בציון יוסף הצדיק יום יום, מבלי להחסיר כמעט אף יום. הוא זועק, כותב מאמר ומחלק אותו בכנס רבנים, מגיע לנחם את משפחת יוסף בבית ג'אן, ולבו הטהור סוער. בבוקר שבת תשובה נודע שצה""ל החליט להפקיר את יוסף הצדיק, ולברוח ממתחם הקבר. הלל לא מסוגל להפקיר את יוסף הצדיק, ומכוח היחידה שבנפש הוא יוצא לעבר מקור החיות שלו, יוסף הצדיק. בדרך הוא נרצח בידי פורעים ארורים.
עשרים וחמש שנה חלפו, וישיבת 'עוד יוסף חי' גלתה ממקומה. הלימוד ממשיך, הדור הראשון של תלמידי הישיבה מגדלים כבר נכדים ואף נינים בשומרון, אבל יוסף הצדיק איננו. ""הנער איננו - ואני אנה אני בא"".
במהלך השנים התפתחו ""כניסות ליליות"", בהן שוהים בציון יהודים רבים, וזוכים להתחבר ליוסף הצדיק. אבל זה רחוק מלהיות המצב השפוי, בו קבר יוסף הצדיק נגיש לכל מי שרוצה לעלות על ציונו, וסמוך לציון קיימת ישיבה בה עוסקים בתורה מכוח החיבור ליוסף הצדיק.
במאמר מוסגר גם נזכיר שאפילו לפי הסכמי אוסלו - מתחם הישיבה הוא בשליטה ישראלית, כך שהיציאה מקבר יוסף היא כניעה לטרור 'נטו', בלי שום בסיס חוקי או משפטי - שלא לומר מוסרי.
לפני כשבועיים פנינו, יחד עם ראש המועצה, יוסי דגן, וחבר הכנסת צבי סוכות, בוגר הישיבה וחתנו של הרב הלל הי""ד, במכתב לשר הבטחון; במכתב ביקשנו לשהות בראש השנה בקבר יוסף, ולתקן בכך את חרפת הגירוש מלפני חצי יובל. מצאנו אוזן קשבת ורצון טוב במשרד הבטחון - אך לצערנו לא הגענו ליעד, ובראש השנה עוד לא שבנו ליוסף.
כלפי הטוענים שהדבר יכביד על כוח האדם של צה""ל - חשוב להבהיר: הכבדה על כוח האדם נובעת בראש ובראשונה מהכניעה לטרור ולרשעות. בדרך קצרה שהיא ארוכה - 'חוסכים' בכוח האדם, מוותרים ונכנעים - ומשלמים בסוף מחירים נוראים! בדרך ארוכה שהיא קצרה - נלחמים על הטוב והצדק, מונעים מהטרור לנצח - ומגיעים למצב בריא שמצריך הרבה פחות מאמצים.
היום המיוחד הזה, יום הזיכרון לרב הלל הי""ד ושבו אנחנו מציינים 25 שנה להפקרת יוסף הצדיק - הוא יום בו חשוב לזעוק ולא לשכוח: חוזרים ליוסף הצדיק!
הכותב הוא ראש ישיבת עוד יוסף חי.",2727
https://www.inn.co.il/news/679908,למה הם שמחים כשנתניהו נכשל?,,"ערוץ 7
דעות
למה הם שמחים כשנתניהו נכשל?
גם מי שאינו תומך בנתניהו חייב להבין שפגיעה בו בזירה הבינלאומית - היא פגיעה במדינה כולה, בייחוד בזמן כה רגיש בזירה המדינית והצבאית.
2 דקות
האיש הזה, שאפשר לאהוב ואפשר שלא, שאפשר להסכים ואפשר לחלוק, שאפשר לקבל ואפשר שלא שאפשר להעריץ ואפשר לתעב, האיש הזה הוא ראש ממשלת ישראל, ראש הממשלה של האוהבים והאוהבים פחות, המסכימים והחולקים, המקבלים והלא מקבלים, המעריצים והמתעבים, ראש הממשלה שנבחר בבחירות דמוקרטיות ברוב מובהק, בעוד כשנה יעמוד שוב למבחן העם, מבחן הבחירות הדמוקרטיות.
לא צריך, לא חובה, אין צוו מיוחד להריע לאיש הזה, המנהל מלחמה בשבע מערכות, המנהל תמרון מדיני מול מדינות ששכחו מהר מדי את טבח שבת שמחת תורה, המנהל את ממשלת ישראל, המנהל את קרב הבלימה נגד הענקת פרס לטרור ולמחוללי ומבצעי הטבח, הקמת מדינה פלשתינאית.
אך מה מניע, מוביל וגורם לאנשים נורמטיביים, אזרחי מדינת ישראל, דמוקרטים, פטריוטים על פי עדותם, מניפי דגל הלאום מעל כל גשר ועל כל כביש אפוף עשן, להתנהג בעדריות, בעיצומה של מלחמה בשדות המערכה ובשדה המדיני, לשמוח לאידו של ראש הממשלה.
הם אינם מבינים כי לא לאידו של ראש הממשלה הם שמחים כי אם לאדה של מדינת ישראל, הם אינם מבינים כי פרץ מחיאות הכפיים על כל מדינה המביעה התנגדות למדיניות הממשלה זו התנגדות למדינת ישראל.
הם אינם מבינים כי צהלות השמחה על כל מנהיג אירופאי המתיירא מהשתלטות המוסלמים על המרחב הציבורי, אלו צהלות נגד מדינת ישראל.
הם אינם מבינים כי היציאה במחולות אל מול גלי האנטישמיות, היא יציאה במחולות נגד מדינת ישראל, הם אינם מבינים כי האושר הגדול הנסוך על פניהם אל מול דחיית הריבונות על ידי הנשיא, הוא נגד מדינת ישראל.
הם אינם מבינים כי הריר מזווית הפה היוצא מאליו בעקבות ויכוח בין ראש הממשלה לנשיא ארה""ב, היא נגד מדינת ישראל, הם אינם מבינים שחיכוך הידיים אל מול הדהוד עלילות דם על ממשלת ישראל, חייליה ומפקדיה בבית הדין הבינלאומי בהאג, הם נגד מדינת ישראל.
זה לא האיש הזה, זה לא בנימין נתניהו, זה לא ראש ממשלת ישראל על תנאי, זה אתם, אנחנו, הם, כל אזרחי מדינת ישראל, כשראש הממשלה עומד על במת האו""ם הוא עומד בשם כל עם ישראל, בשם מדינת ישראל.
ראש ממשלת ישראל עמד על בימת האו""ם כשליחו של העם היהודי, כל העם היהודי כולל מתנגדיו הפוליטיים החריפים והנוקבים ביותר, היו חייבים לעמוד לצידו, להתפלל להצלחת שליחותו, למען העם היהודי, למען מדינת ישראל, למען עתידו של העם היהודי.
במקום להתייצב כאיש אחד בלב אחד, מבית ומחוץ, מאחרי ראש ממשלת ישראל במסעו החשוב, תייצבו אנשי השנאה בידם נס המרד ואות האיבה, יורים בו בליסטראות של עלבונות, ביזיונות, חרפות, גידופים והאשמות, מהדהדים את עלילות הדם מתחביב רצח התינוקות, דרך תעמולת ההרעבה ועד לרצח העם, עדר של שונאים שאיבדו את המצפן והמצפון, המצהירים ללא בושה כי הם מאמינים לחמאס ולא לראש הממשלה.
לו היה מדובר רק בקומץ הפונדמנטליסטים, הקיצונים שורפי האסמים, מבאישי ריחה של המדינה בעולם, מחוללי הכאוס, מעודדי האג ומחבקי שונאי ישראל, לא היה ראוי להשחית זמן על חבורת מופקרים וחסרי אחריות אלה, ברם, לדאבון הלב אש השנאה והעיוורון יותר ממלחכים את גלימת האחים מהשמאל הציוני, תופעת העדריות המתפשטת היא סכנה אמיתית למדינת ישראל, הצלחתו של ראש ממשלת ישראל היא הצלחת מדינת ישראל.",2853
https://www.inn.co.il/news/679916,בזיהוי מהיר של סיירת גבעתי: המחבל הסתתר מתחת לשמיכה - וחוסל,,"ערוץ 7
ביטחון
בזיהוי מהיר של סיירת גבעתי: המחבל הסתתר מתחת לשמיכה - וחוסל
המחבל התקרב לעמדת הכוחות כשהוא מסתתר תחת שמיכה. מיד לאחר הזיהוי, הלוחמים פתחו בירי וחיסלו אותו.
לוחמי סיירת גבעתי זיהו היום (שלישי) בעזה מחבל מארגון הטרור הרצחני חמאס שהיה חמוש בנשק וברימונים.
המחבל התקרב לעמדת הכוחות כשהוא מסתתר תחת שמיכה. מיד לאחר הזיהוי, הלוחמים פתחו בירי וחיסלו אותו. לא היו נפגעים בקרב כוחות צה""ל.
אמש (שני), כוחות צוות הקרב של חטיבת כפיר, הפועלים תחת אוגדה 36 בעיר עזה, זיהו שני מחבלים חמושים שניסו להתקרב לעבר מגנן של הכוח. זמן קצר לאחר הזיהוי, תקף מכלול האש של חטיבת כפיר בהכוונת הכוחות בשטח, מה שהוביל לחיסול המחבלים.
בנוסף, אוגדה 98, הפועלת גם היא במרחב העיר עזה, תקפה מחבל שהיה ראש חוליית חמאס, וביצעה חיסול של שלושה מחבלים נוספים. אוגדה 162 המשיכה במאבק בעיר עזה, שם חיסלה מספר מחבלים במפגש ישיר בשטח בעזרת סיוע מהאוויר.
כוחות אוגדה 99, הפועלים בצפון רצועת עזה, המשיכו לפגוע במבנים שולטים ומטרות מודיעניות ברחבי האזור, וביממה האחרונה השמידו מספר תשתיות טרור.
חיל האוויר תקף ביממה האחרונה יותר מ-160 מטרות טרור ברחבי הרצועה, ביניהן מחבלים, מחסני אמצעי לחימה, עמדות תצפית ותשתיות טרור נוספות.
לקריאת הכתבה באתר באנגלית",1119
https://www.inn.co.il/news/679907,חמאס ידחה את תוכנית טראמפ?,,"ערוץ 7
העולם הערבי
חמאס ידחה את תוכנית טראמפ?
בכיר פלסטיני המזוהה עם חמאס אומר כי תוכנית טראמפ אינה מבטאת ""פתרון אמיתי"" וכל הצעה המתעלמת מזכויות הפלסטינים ""פסולה לחלוטין"".
ארגון הטרור הרצחני חמאס טרם הגיב רשמית על תוכנית הנשיא האמריקני דונלד טראמפ לסיום המלחמה ברצועת עזה.
רמז אפשרי על העמדה המתגבשת של חמאס ניתן למצוא בדברים שאמר בעניין זה איסמאעיל אל-ת'וואבתה, מנכ""ל לשכת התקשורת הממשלתית ברצועת עזה הנתונה לשליטת חמאס.
אל-ת'וואבתה אמר כי תוכנית טראמפ אינה מבטאת ""פתרון אמיתי"", אלא מדובר בניסיון להעניק לגיטימציה לכיבוש בחסות בינלאומית, השולל מהעם הפלסטיני את זכויותיו הלאומיות, המדיניות וההומניטריות.
לדבריו, הדרך היחידה להפסקת המלחמה היא סיום ""התוקפנות"", הסרת המצור מעל רצועת עזה, הפסקת ""ההשמדה"", והבטחת זכויות העם הפלסטיני לחירות, לעצמאות ולהגדרה עצמית.
הוא הדגיש כי כל הצעה המתעלמת מזכויות הפלסטינים והנוהגת בעזה כישות נטולת ריבונות תחת ניהול בינלאומי ""פסולה לחלוטין"" מבחינה פלסטינית.",890
https://www.inn.co.il/news/679914,10 חודשי מאסר למנהל עבודה ששלח עובד בלתי מוסמך להפעיל עגורן וגרם למותו,,"ערוץ 7
משפט ופלילים
10 חודשי מאסר למנהל עבודה ששלח עובד בלתי מוסמך להפעיל עגורן וגרם למותו
השופט צבי פורר גזר עונש מאסר על דוד עובדיה ששלח את יורי סבצ'וק ז""ל להפעיל עגורן ללא הסמכה. גם אביב אלבז נענש. ""הגנה על ערכי החיים והבטיחות מחייבת ענישה הולמת"", אמר.
1 דקות
בית משפט השלום באשקלון גזר לאחרונה עונשי מאסר, עבודות שירות ופיצוי כספי על שני מנהלים במפעל באשדוד, בעקבות תאונת עבודה קטלנית שאירעה במקום ביוזמתם.
הנאשמים, דוד עובדיה ואביב אלבז, שימשו כמנהלי עבודה במפעל שבו נהרג יורי סבצ'וק ז""ל במהלך הפעלת עגורן. עובדיה נידון ל-10 חודשי מאסר בפועל, 6 חודשי מאסר על תנאי ופיצוי כספי בסך 50,000 ש""ח, לאחר שהורשע בעבירת גרימת מוות ברשלנות. אלבז נידון ל-300 שעות עבודה לתועלת הציבור, מאסר על תנאי ופיצוי בגובה 150,000 ש""ח, לאחר שהורשע בעבירה של הפרת הוראות הבטיחות בעבודה.
לפי כתב האישום המתוקן שהוגש במסגרת הסדר טיעון על-ידי פרקליטות מחוז דרום, סבצ'וק התבקש על-ידי עובדיה להפעיל עגורן מבלי שהוסמך לכך ומבלי שצויד באמצעי מיגון כנדרש. במהלך ההפעלה השתחרר מטען שנפל עליו וגרם למותו. עוד עלה כי הממונה על הבטיחות התריע בפני עובדיה ואלבז על הליקויים, אך לא ננקטו צעדים לתיקונם.
במהלך הטיעונים לעונש ציין עו""ד ואדים סיגל, מפרקליטות מחוז דרום, כי דיני הבטיחות נועדו להגן על העובדים: ""הם נועדו למנוע השלכות כלכליות קשות וגם לשמור על חיי אדם. מדובר באקלים בטיחותי רעוע שיש לשנות.""
במסגרת גזר הדין ציין השופט צבי פורר: ""לצערי כמעט מדי שבוע שומעים אנו על תאונות מצערות באתרי עבודה... לא יעלה על הדעת כי אדם היוצא לעבודתו לא ישוב ממנה כתוצאה מהפרת כללים אלה ומרשלנות של מנהליו."" עוד הדגיש: ""הגנה על ערכי החיים והבטיחות מחייבת ענישה הולמת.""
לאחר מתן גזר הדין אמר עו""ד סיגל, המשמש גם כראש פורום רשלנות בפרקליטות המדינה: ""גזר הדין הוא דוגמה למאבק הבלתי מתפשר שלנו בתופעת תאונות העבודה... אנו שואפים להחמרת האכיפה והענישה מתוך מטרה ליצור הרתעה ממשית.""",1731
https://www.inn.co.il/news/679897,אלמנתו של הרב נערן אשחר התחתנה,,"ערוץ 7
כיפה סרוגה
אלמנתו של הרב נערן אשחר התחתנה
כמעט שנתיים לאחר שבעלה נהרג, נישאה צוף אשחר לעמיחי וייס, שאמר בחופה: ""אור נשמתו של נערן מאיר לנו ומאיר אותנו"".
כמעט שנתיים לאחר שבעלה נפל במלחמה, נישאה השבוע צוף אשחר לעמיחי וייס מאפרת. צוף היא אלמנתו של רס""ר (במיל') הרב נערן אשחר ז""ל, שנהרג בצפון במהלך מלחמת חרבות ברזל.
החתונה התקיימה בנוכחות בני משפחה, חברים ומכרים, שליוו את בני הזוג ברגש, אהבה ותפילה לעתיד טוב יותר.
במהלך החופה נשא עמיחי וייס דברים. ""מאת ה' הייתה זאת, היא נפלאת בעינינו. איננו יודעים איך ה' מנהיג את עולמו, אין לנו השגה בשכלנו מה חשבונו של ריבונו של עולם, אך בטוחים שהכול נתון תחת השגחה. טוב ה' לכל ורחמיו על כל מעשיו. אנחנו יודעים שמלך חפץ בחיים טובים לעם שלו. בתחילת דרכנו הרוחנית אנחנו מרגישים ותשאני רוח - כוח שמימי עליון שדוחף ומרים אותנו, ואנחנו מסייעים בידו.
הרוגי מלכות - אין כל בריה יכולה לעמוד במחיצתם. נערן יושב תחת כיסא הכבוד ומסייע לדיין אלמנות להדריך אותנו ולכוון את דרכנו. אור נשמתו מאיר לנו ומאיר אותנו. ביתנו הולך ונבנה - על גבי ומתוך הבית הראשון"", סיכם.
סיפורה של צוף יוצג בסרט ""מצפה לו"", החל מה7.10 בשעה 21:15 ב- HOT8, ב- HOTVOD וב NEXT TV.",1081
