url,title,published_at,content,content_chars
https://www.inn.co.il/news/678312,"חופשת חג מושלמת לכל המשפחה, בלי טרחה ובלי דאגות",,"ערוץ 7
בארץ
חופשת חג מושלמת לכל המשפחה, בלי טרחה ובלי דאגות
דמיינתם פעם סוכות בלי עייפות ובלי התרוצצויות? אלפי משפחות כבר גילו את הפתרון - מלון יוקרתי שמציע חוויה רוחנית, משפחתית וקולינרית, וכל זה באווירה חגיגית ומפנקת.
1 דקות
במלון גני ירושלים חוגגים סוכות בלי דאגות: סוכה מהודרת, סעודות גורמה, תפילות חג מרגשות עם חזן נודע, שמחת בית השואבה עם אורי וואסנר, חדרי אירוח מפנקים ואווירה משפחתית חמה. לגולשי ערוץ 7 - 10% הנחה בלעדית.
מה מצפה לכם בסוכות הקרוב?
ארוחות גורמה עשירות - מנות חגיגיות, קינוחים מפנקים ושפע קולינרי מידי מיטב השפים.
תפילות חג מרגשות - עם חזן נודע ומנוסה, באווירה קדושה ומיוחדת.
שמחת בית השואבה סוחפת - עם שירה, נגינה וריקודים בהובלת הקומזיצער אורי וואסנר.
חדרי אירוח מפנקים - חדרים חדשים, מיטות רחבות, עיצוב חדשני ומקלחות מרווחות.
אווירה משפחתית ושמחה - פוגשים אנשים חדשים, שמחים יחד וחווים חג מלא משמעות.
לקבלת קוד קופון ולהזמנות חייגו 02-6558811 או פנו ל מנהל המכירות האישי שלנו - כאן בוואטסאפ
מה אומרים האורחים?
מר ח. פ., בן 62, מספר, ""כל שנה היית שובר את הגב עם הסוכה ובסוף מגיע מותש לחג. הפעם הגעתי למלון יחד עם אשתי היקרה והכול היה מוכן בשבילנו. ישבנו בסוכה רחבה, אכלתי סעודות גורמה ולא הפסקתי להודות לה' על הפתרון הנדיר הזה"".
משפחת שטרן מירושלים מוסיפה, ""הגענו עם כל המשפחה - הילדים נהנו, אנחנו נחנו, והאווירה הייתה פשוט מטורפת. שמחת בית השואבה הייתה משהו שלא חווינו בשום מקום אחר. כבר החלטנו - גם בשנה הבאה אנחנו כאן"".
בונוס לגולשי ערוץ 7 - 10% הנחה בלעדית על כל ימי החג!
אל תוותרו על חוויית סוכות אמיתית - רק נחת, שמחה ואווירה רוחנית מרוממת, במלון שדואג לכל פרט.
מקומות אחרונים - הזמינו עכשיו ותבטיחו חג בלתי נשכח!",1544
https://www.inn.co.il/news/679900,הסכם פיצויים דרמטי: יוטיוב תשלם 24.5 מיליון דולר לטראמפ,,"ערוץ 7
בעולם
הסכם פיצויים דרמטי: יוטיוב תשלם 24.5 מיליון דולר לטראמפ
חברת יוטיוב, שבבעלות אלפבית, תעביר 24.5 מיליון דולר להסדרת תביעה שהגיש נגדה נשיא ארה""ב דונלד טראמפ. עיקר הסכום יועבר לפרויקט בנייה בשטח הבית הלבן, והחברה לא הודתה באחריות.
יוטיוב, שבבעלות חברת אלפבית (חברת האם של גוגל) הסכימה לשלם 24.5 מיליון דולר לצורך הסדרת תביעה שהגיש נגדה נשיא ארצות הברית דונלד טראמפ, כך עולה ממסמכים שהוגשו לבית המשפט.
התביעה עסקה בהשעיית חשבונו של טראמפ בעקבות מהומות הקפיטול בינואר 2021.
מדובר בחברת הטכנולוגיה השלישית שמסיימת בהסדר משפטי תביעה מצד טראמפ, אשר טען כי הושתק באופן לא חוקי לאחר כהונתו הראשונה כנשיא. קודם לכן, פייסבוק (כיום מטא) שילמה 25 מיליון דולר, וטוויטר - ששינתה את שמה ל-X - שילמה 10 מיליון דולר במסגרת פשרות דומות.
בכל אחת מהן טען הנשיא כי נחסמה זכותו לביטוי וכי קול השמרנים הושתק באופן בלתי חוקי.
מתוך סכום הפיצויים, 22 מיליון דולר יועברו מטעם טראמפ לקרן Trust for the National Mall, הקרן שמתחזקת את שדרת ""המול"" הלאומי בוושינגטון, וכן לסיוע בהקמת אולם נשפים בבית הלבן. לפי המסמכים, האולם החדש יתפרש על שטח של כ-8,361 מ""ר וצפוי להיבנות עד תום כהונתו הנוכחית של טראמפ בינואר 2029.
היתרה תועבר לגורמים נוספים בתביעה, בהם האיחוד השמרני האמריקני (ACU) ומחברת הספרים נעמי וולף.",1187
https://www.inn.co.il/news/679899,"רוטמן ליועמ""שית: ""אנחנו מפריעים לך לנהל את המדינה?""",,"ערוץ 7
מדיניות ופוליטיקה
רוטמן ליועמ""שית: ""אנחנו מפריעים לך לנהל את המדינה?""
ח""כ שמחה רוטמן מתח ביקורת חריפה על היועצת המשפטית לממשלה שהשתתפה בוועדה וטענה כי הוא מתערב ביחסים בינה לבין ראש הממשלה. בהמשך התעמתו בהקשר לראש השב""כ דוד זיני. צפו
2 דקות
בוועדת החוקה מתקיים הבוקר (שלישי) דיון סוער בהשתתפות היועצת המשפטית לממשלה שספגה ביקורת חריפה מיושב הראש ח""כ שמחה רוטמן שזעם על כך שהיא מתפרצת לדבריו פעם אחר פעם.
רוטמן פתח את הישיבה, פנה ליועצת המשפטית וטען לא קיבל תשובה למסמך מענה מפורט שאותו ביקש באוגוסט 2024 בנושא המאבק בפשיעה המאורגנת. בהרב-מיארה השיבה כי המענה ניתן בנובמבר של אותה שנה. רוטמן טען כי מאז ביקש שוב מענה לשאלות נוספות.
בהרב-מיארה אמרה ""אני רואה שכל מה שאמרנו בדיונים האחרונים עולה עוד פעם"", והוא השיב: ""אני מזמן אותך לדיונים כי כשאני מבקש מידע אני לא מקבל. את שולחת אליי נציגים לדיון, נשאלות שאלות והם מסרבים לענות"".
היועמ""שית קטעה את רוטמן והוא מצידו דפק עם הפטיש על השולחן כמה פעמים, והרים את הקול: ""גברתי היועצת, סליחה, לא. את מתפרצת לדבריי. ההתנהלות הזו לא מקובלת!"". הוא הוסיף: ""לא פלא שנציגייך מרשים לעצמם להתנהג בחוצפה"".
ח""כ גלעד קריב מהאופוזיציה הזכיר שיום כיפור מתקרב ותהה: ""יש פקקי אוזניים למישהו?"". רוטמן ביקש ממנו להפסיק והמשיך למתוח ביקורת על היועמ""שית. ""מעולם לא נתקלתי בעובד מדינה שמתפרץ כל כך בקלות לדברי יושב הראש. לצערי, את עובדת מדינה"". בשלב הזה קטעו את דבריו מספר חברי הכנסת מהאופוזיציה ורוטמן הוציא את ח""כ קריב מהדיון.
בהרב-מיארה אמרה כי ""אין לצוות העל למלחמה בפשיעה הערבית סמכות תקציבית מיוחדת, אלא היא חלק מהקצאות הממשלה. צוות העל הוא צוות רחב. קשה לתת דיווח על נושאים סודיים"". רוטמן השיב: ""אז תעבירו מידע סודי בדיון סגור. מי שמחליט מה סודי זה אני, כיו""ר הוועדה. נתבקשת לסווג את ארגוני הפשיעה כארגוני טרור - היכן זה עומד?"". בהרב-מיארה הרימה את קולה ודרשה: ""זימנת אותנו לדיון אחר על הרוגלות ועל צוות העל למלחמה בפשע, ואני עומדת על כך שהדיון יהיה בנושא הרוגלות"".
רוטמן הטיח ביועמ""שית: ""מעולם לא נתקלתי בעובד מדינה שמתפרץ כל כך הרבה, ולצערי את עובדת מדינה ולא תדברי כך. ראש הממשלה הנחה ואתם לא המשכתם"". היועמ""שית השיבה: ""לא אתייחס. ורה""מ לא הנחה לאור 'מצב החירום השורר במדינה'. אודה לך שלא תתערב ביחסיי עם רה""מ"".
רוטמן: ""כשאת אומרת לוועדה של הכנסת 'אל תתערב במערכת היחסים עם רה""מ - זה לא מקובל עליי. סליחה שאנחנו נבחרי הציבור מפריעים לך לנהל את המדינה"".
ח""כ טלי גוטליב האשימה את היועמ""שית: ""סירסתם את המשטרה. אתם מנהלים אותה ובמהלך השנים נתתם הנחיות של מעורבות שלכם בחקירות. את לא מתמצאת בחקירות פליליות ולא יכולה לנהל חקירות פשע מאורגן"". בהמשך פנתה ליועמ""שית ותהתה: ""למה את לא מגישה את כתב האישום נגדי? למה יאיר גולן או אהוד ברק לא נחקרו?"".
פרקליט המדינה איסמן אמר בוועדה: ""המאבק בארגוני הפשיעה הוא אחד מיעדינו המרכזיים. קיבלנו רק 30 תקנים והמשטרה יותר מ-100 תקנים. הוגשו כ-500 כתבי אישום בעבירות נשק. אנחנו מגישים תיקים רק אם יש סיכוי סביר להרשעה, ולא קובעים יעדים למספר כתבי אישום. אין לי מושג כמה כלי נשק יש בשטח, ולכן אני לא יכול לומר אם 500 כתבי אישום זה הרבה או מעט"".",2812
https://www.inn.co.il/news/679898,תיעוד: מחבלים התקרבו למגנן בעזה - וחוסלו,,"ערוץ 7
ביטחון
תיעוד: מחבלים התקרבו למגנן בעזה - וחוסלו
שני מחבלים חמושים שהתקרבו למגנן בעיר עזה חוסלו על ידי כוחות מחטיבת כפיר. חיל האוויר תקף יותר מ-160 מטרות טרור.
כוחות צה""ל בפיקוד הדרום, בהכוונת אמ""ן ושב""כ, ממשיכים לפעול באופן אינטנסיבי נגד ארגוני הטרור ברחבי רצועת עזה כחלק ממבצע 'מרכבות גדעון ב'.
אמש (שני), כוחות צוות הקרב של חטיבת כפיר, הפועלים תחת אוגדה 36 בעיר עזה, זיהו שני מחבלים חמושים שניסו להתקרב לעבר מגנן של הכוח. זמן קצר לאחר הזיהוי, תקף מכלול האש של חטיבת כפיר בהכוונת הכוחות בשטח, מה שהוביל לחיסול המחבלים.
בנוסף, אוגדה 98, הפועלת גם היא במרחב העיר עזה, תקפה מחבל שהיה ראש חוליית חמאס, וביצעה חיסול של שלושה מחבלים נוספים. אוגדה 162 המשיכה במאבק בעיר עזה, שם חיסלה מספר מחבלים במפגש ישיר בשטח בעזרת סיוע מהאוויר.
כוחות אוגדה 99, הפועלים בצפון רצועת עזה, המשיכו לפגוע במבנים שולטים ומטרות מודיעניות ברחבי האזור, וביממה האחרונה השמידו מספר תשתיות טרור.
חיל האוויר תקף ביממה האחרונה יותר מ-160 מטרות טרור ברחבי הרצועה, ביניהן מחבלים, מחסני אמצעי לחימה, עמדות תצפית ותשתיות טרור נוספות.",1002
https://www.inn.co.il/news/679895,"השר סמוטריץ': חזרה לקונספציית אוסלו, החמצה היסטורית",,"ערוץ 7
מדיניות ופוליטיקה
השר סמוטריץ': חזרה לקונספציית אוסלו, החמצה היסטורית
השר בצלאל סמוטריץ' יוצא נגד הסכם 21 הנקודות של טראמפ: ""חוזרים לדפוסי אוסלו, מפקירים את הביטחון, עוצמים עיניים מול המציאות ונשלם על כך ביוקר - שוב"".
1 דקות
יו""ר מפלגת הציונות הדתית ושר האוצר בצלאל סמוטריץ' התייחס הבוקר (שלישי) להסכמות המדיניות עם נשיא ארה""ב ותכנית 21 הנקודות.
לדבריו, מדובר בחזרה מסוכנת לתפיסות שנכשלו בעבר ובויתור על הישגים אסטרטגיים משמעותיים.
""יש לי הרבה מה לומר, ואעשה זאת בע""ה לאחר שורת התייעצויות שאקיים היום. אבל יש דבר אחד שכבר אפשר לומר, וסליחה מראש על השבתת השמחה והראיה המפוכחת של המציאות: לחזור אחרי ה־7 לאוקטובר ואחרי שנתיים של מסירות וגבורה והקרבה של עם של אריות, עם מחירים כואבים ועם הישגים דרמטיים ברוך השם ובעזרתו בכל הזירות, לתפיסה הישנה של הפקרת ביטחוננו בידי זרים ודמיונות שמישהו אחר יעשה עבורנו את העבודה 'בלי בג""ץ ובלי בצלם', להמרת הישגים ממשיים בשטח באשליות מדיניות והתמסרות לחיבוק דב מדיני וטקסים נוצצים, לזמירות מדיניות של 'שתי מדינות', 'פלשתינים ישלטו על פלשתינים', הקמת משטרה פלשתינית שתאומן על ידי מצרים וירדן ובנאום הסכסוך, קטאר כשחקן מרכזי - כל הדייסה הזו זה כל כך 'אולד פשן' וחזרה לקונספציית אוסלו"".
הוא הדגיש כי מדובר ב""החמצה היסטורית של ההזדמנות הכי מוצדקת בעולם להשתחרר סוף סוף מכבלי אוסלו, כישלון מדיני מהדהד, עצימת עיניים והפניית עורף לכל לקחי ה־7 לאוקטובר"", והוסיף, ""ולהערכתי זה גם ייגמר בבכי. ילדינו יאלצו להילחם שוב בעזה. זה מה שאיינשטיין הגדיר כשטות גמורה: לחזור על אותה פעולה שוב ושוב ולצפות לתוצאה אחרת"".
סמוטריץ' הזהיר מפני הנהגה שאינה נושאת חזון מדיני ברור, ואמר כי ""זו טרגדיה של מנהיגות בורחת מבשורה"". הוא הוסיף ושאל, ""האם עוד יש סיכוי שמעז יצא מתוק? שסרבנות האויב שוב תציל אותנו מעצמנו כמו פעמים רבות בעבר והמציאות תאלץ אותנו לשוב לדרך של גבורה וניצחון ולקיחת אחריות על גורלנו וביטחוננו, והפעם עם גיבוי בינלאומי רחב יותר?"".
בהמשך ציין את שיקוליו לקראת קבלת החלטה ואמר, ""האם במציאות שנוצרה מול הלחץ הבינלאומי, קמפיין החטופים ההרסני, חוסר הרצון מראש של רה""מ נתניהו לכבוש את עזה ולאמץ את תכנית טראמפ המקורית, גרירת הרגליים הצבאית וחוסר ההצלחה להביא את ראשי הצבא למקום שאנחנו רוצים, הקואליציה המקרטעת ועייפות החומר הטבעית אחרי שנתיים מלחמה - האם על רקע כל זאת אין ברירה וזה המקסימום שאפשר להשיג כרגע? אלו שאלות טובות. נתייעץ, נשקול ונחליט בעזרת השם"".
את דבריו חתם באמירה נוקבת, ""אבל החגיגות מאז אתמול הן פשוט מופרכות"".
לקריאת הכתבה באתר באנגלית",2279
https://www.inn.co.il/news/678990,"צום, תפילה וכשירות מבצעית: הנחיות הלכתיות ורפואיות מיוחדות לחיילי צה""ל ביום הכיפורים",,"ערוץ 7
בארץ
צום, תפילה וכשירות מבצעית: הנחיות הלכתיות ורפואיות מיוחדות לחיילי צה""ל ביום הכיפורים
הרב יוסף צבי רימון, רב מועצת גוש עציון וראש בתי המדרש במרכז האקדמי לב, וד""ר אבי הרמן, מומחה לרפואה פנימית ממכבי שירותי בריאות עם כל התשובות לשאלות חיילים שנמצאים בפעילות מבצעית במהלך יום הכיפורים
1 דקות
בצל המלחמה המתמשכת, יום הכיפורים הקרוב מקבל משמעות מיוחדת עבור אלפי חיילים המוצבים בחזית. לצד הלחימה, מתעוררות שאלות הלכתיות ורפואיות מורכבות, והצורך בהנחיות ברורות גדול מתמיד.
הרב יוסף צבי רימון, מהפוסקים הבולטים בציונות הדתית, פותח במסר מחזק ללוחמים, ""אני חייב להגיד בתוך כל הקושי והבכי, אפשר לראות את העוצמה האדירה של החיילים שלנו, את הרוממות, דברים שלא ראינו אלפי שנים"". לדבריו, ""יום כיפור במהותו הוא יום כפרה לישראל כשהכהן הגדול נכנס לקודש הקודשים. גם אתם חיילים יקרים נמצאים בקודש הקודשים. אתם נמצאים בתור אלה שמוסרים את חייהם בשביל לקדש שם שמיים"".
במוקד ההנחיות עומד נושא הצום. הרב רימון מדגיש, ""כשהחיילים נמצאים בלחימה, או ממש בכוננות, מצד הדין אין להם צום בכלל. אדם צריך להיות בלחימה בצורה מלאה, בלי צום"". הוא מוסיף כי גם מצבי כוננות גבוהה מחייבים היתר מלא.
ד""ר אבי הרמן ממכבי שירותי בריאות מחזק את הדברים, ומסביר כי ""בן אדם שמגיע למצב של התייבשות או אפילו מצב של קדם התייבשות כמובן לא יכול לתפקד כמו שצריך... הזמן שלוקח מהרגע שהחייל מתחיל לשתות עד שהגוף שלו מלא בנוזלים, זה עניין של שעות. לכן, מאוד חשוב להדגיש שחיילים שנמצאים בכוננות צריכים לשתות"".
לחיילים שאינם מצויים בלחימה מיידית, מציע הרב רימון פתרון של ""שתייה לשיעורים"": כל ארבע דקות, כמות של ""פקק מימייה"". שיטה זו מאפשרת לשמור על בריאות מבלי לבטל לחלוטין את הצום.
גם התפילות הארוכות מותאמות למציאות המבצעית. ""מצד הדין אפשר לוותר על כל הפיוטים, על כל המנגינות, ואז התפילה מהירה"", מסביר הרב רימון. עם זאת הוא ממליץ לשמור על נקודות מרכזיות כמו ""ונתנה תוקף"", וכן לומר וידוי מקוצר, ""אפילו אם אדם אומר 'חטאנו לפניך', מספיק"". במצב של לחימה, ניתן להסתפק בקריאת שמע ותפילת עמידה בלבד.
ד""ר הרמן מוסיף כי שמירה על מצב פיזי תקין חשובה גם בעת פציעה ושיקום, ""כדי שיהיה יותר קל לטפל בו, הוא צריך גם לבוא במצב פיזי טוב... לאכילה ולשתייה יש מקום מאוד מאוד קריטי בשיקום ובהחלמה של הפציעה"".
בנוגע לשאר עינויי היום, פוסק הרב רימון כי חיילים נועלים נעליים רגילות, שוטפים פנים ואף מצחצחים שיניים. ""חייל הולך עם נעליים רגילות, חייל שוטף פנים, אין ברירה, צריך להיות בעניינים"". רק מי שנמצא במנוחה מוחלטת יכול להחמיר מעט, למשל בהוספת חול לנעליו, אך הכלל המנחה ברור - חיי אדם וכשירות מבצעית קודמים לכל.",2343
