url,title,published_at,content,content_chars
https://www.inn.co.il/news/679935,דיווח בצרפת: שגריר דרום אפריקה נפל אל מותו מהקומה ה-22,,"ערוץ 7
בעולם
דיווח בצרפת: שגריר דרום אפריקה נפל אל מותו מהקומה ה-22
אשתו דיווחה כי היא חוששת לחייו לאחר שקיבלה ממנו הודעת טקסט שהדאיגה אותה. זמן קצר אחר כך התקבלו הדיווחים כי אותרה גופתו.
גופתו של שגריר דרום אפריקה בצרפת, נקוסינתי עמנואל ""נאתי"" מת'טווה, נמצאה בפריז בשעות הצהריים (שלישי), כך דיווח אתר העיתון הצרפתי ""לה פריזיאן"".
על פי הדיווח השגריר נפל מהקומה ה-22 של מלון הייאט ברובע ה-17 של פריז. אשתו דיווחה כי היא חוששת לחייו לאחר שקיבלה ממנו הודעת טקסט שהדאיגה אותה. משטרת פריז פתחה בחקירת נסיבות מותו של השגריר.
דובר במחלקת החוץ של דרום אפריקה אמר כי הם ""מודעים לדיווחים מצערים הנוגעים לשגריר נאתי מת'טווה"" ויפרסמו הצהרה ברגע שיתקבל מידע רשמי בנושא.
מת'טווה החל את כהונתו כשגריר בפריז בפברואר 2024 וכיהן גם כנציג הקבוע של המדינה לאונסק""ו כחלק מתפקידו.
בעבר מילא מספר תפקידים בממשלת דרום אפריקה.",801
https://www.inn.co.il/news/679934,"סמוטריץ' ובן גביר, אל תפרשו מהממשלה",,"ערוץ 7
מדיניות ופוליטיקה
סמוטריץ' ובן גביר, אל תפרשו מהממשלה
חכו לתשובת חמאס, וגם אז, הן מבחינה אלקטורלית והן מבחינה אידיאולוגית - עדיף שתישארו בפנים, גם אם הריבונות ביו""ש תתעכב וההתיישבות בעזה לא תתחדש
2 דקות
צריך לומר ביושר, מלכתחילה החלת הריבונות הייתה קלף מדיני שנועד למשא ומתן. זה לא צריך להיות כך, אבל זה המצב כרגע.
צריך גם להכיר בכך שתוכנית טראמפ, חרף הויתור (הזמני, לפחות) על ההתיישבות מחדש ברצועת עזה, עודנה מביאה להשלמה מלאה של כל יעדי המלחמה - שחרור החטופים, פירוק חמאס והסרת האיומים הביטחוניים על תושבי הצפון והדרום, וכנראה לראשונה בתולדות מדינת ישראל, יעדי המלחמה גם מקבלים גושפנקה מדינית בין-לאומית ולא נרמסים.
צריך גם להוסיף את ההדגש הכמעט מובן מאליו, שהעובדה שטראמפ ונתניהו ואפילו האמיר הקטארי או שונא ישראל מאיסטנבול תומכים בתוכנית, עדיין לא אומרת שחמאס ימלא אחריה. כרגע, לפחות, צריך לצאת מנקודת הנחה שחמאס ינסה למסמס את הסיכום ולהימנע ממנו מבלי לצאת סרבן, עד כמה שהדבר אפשרי. כך או כך, ישראל הרוויחה נקודות דיפלומטיות בכל מקרה.
ולמה כל זה? כדי למנוע מראשי מפלגות הימין שמימין לימין, השרים סמוטריץ' ובן גביר, מלממש את רעיון העוועים של פרישה מהממשלה והפלתה על רקע ההסכמים, וזאת מכמה סיבות:
ראשית, הנה משהו שאתם אולי מפספסים. נכון, בבועה היותר קרובה אליכם אולי מרגישים אכזבה וחמיצות, אבל במעגל הרחב יותר של המצביעים שלכם, הרבה מהם רואים במתרחש הישג נאה, ומאמינים שאת הריבונות ביהודה ושומרון נשיג יותר באמצעות בנייה (E1, לדוגמה) ופחות באמצעות הצהרות דקלרטיביות ריקות ממעש. הפלת הממשלה על רקע כזה לא תתקבל אצלם בברכה. כך שגם בחישוב פוליטי אגואיסטי גרידא, זה לא משתלם לכם.
שנית, בדיוק כמו שגיליתם פרגמטיות בעסקת החטופים האחרונה, ובדיוק כמו שהבנתם שיש גם אילוצים גלובליים לישראל, ושגם כשנתניהו לא נותן לכם מאה אחוז מהקו האידיאולוגי שלכם (ואולי אפילו לא שמונים), זה עדיין לא מצדיק ויתור על כל השאר ושפיכת המים עם התינוק, כך גם כאן. הרי גנץ מחכה מעבר לפינה כדי למתג את עצמו מחדש כמי ש""יחליף את הקיצוניים"". למה לכם להתנדב לזרוק לו את חבל ההצלה הזה, ועל הדרך לעצור סופית את הדחתה של מיארה, את הבנייה ביהודה ושומרון ועוד כהנה וכהנה? למה זה טוב?
שלישית, משום שהגיע הזמן לשבור את התזה המביכה ולפיה ממשלת ימין לא מסוגלת להשלים את ימיה כי תמיד יהיה מי שיקפוץ על עגלת הפרישה כדי לנסות לעשות איזה אקזיט דמיוני. לא תרוויחו קולות מפרישה מוקדמת, הציבור הימני עייף ושבע ממשחקי כוח שכאלה. תקבלו הרבה יותר קרדיט על התנהלות מאוזנת ונבונה.
אז כן, מותר לקטר ולפרוק כעס, אפילו רצוי. זה גם מועיל לנתניהו ולישראל משום שכך העולם מבין שגם מדינת ישראל 'התפשרה' ו'ויתרה' וגם נתניהו מתמודד עם אתגרים פנימיים לא פשוטים כדי להגיע ליעד, אבל אל תשברו את הכלים.
תנו לתהליך להגיע לסיומו כשאתם שותפים גאים בממשלה, חתומים יחד איתה על השבת כלל החטופים, על חיסול מוחלט של החמאס כארגון טרור ועל מעבר של עזה לידיים בינלאומיות בראשות דונלד טראמפ.
ואם כבר הזכרנו את המעבר הזה, הנה עוד סיבה למה צריך אתכם בפנים: הרי אף אחד לא טיפש, וברור לכולם שדקה אחרי שהכוח הבינלאומי ייכנס, יתחיל לחץ על ישראל להסכים לשלב גם את הרשות הפלסטינית באירוע. בשלב זה, נתניהו עומד על שלו וכפי שגם אמר בנוכחות טראמפ במפורש: כל עוד הרשות מלמדת הסתה, מסבסדת טרור ותומכת בשנאת ישראל, שלא לדבר על אי הכרה בישראל ובריבונותה בירושלים, היא לא תהיה בתמונה. וכמו שכל דרדק יודע, הרש""פ בלי כל אלה איננה רש""פ. במילים אחרות, זה לא יקרה.
אבל אם לא תהיו שם, ישראל עשויה להתפשר על זה. גנץ עוד יסביר שאבו מאזן הוא בכלל איש נחמד ואפשר לסמוך על ההבטחות שלו, ולנתניהו אולי לא תהיה ברירה. בשביל זה, גם בשביל זה, צריך שאתם תישארו בתמונה.",3260
https://www.inn.co.il/news/679395,"""פתאום אני קולט שאני מכיר אותו"": הסיפור שלא ייאמן ויכול לקרות רק בישראל",,"ערוץ 7
בארץ
""פתאום אני קולט שאני מכיר אותו"": הסיפור שלא ייאמן ויכול לקרות רק בישראל
פ', קצין מודיעין בגדוד הנדסה, נמצא מתאים ונרתם לתרום מח עצם לאדם שלא הכיר באמצעות מאגר מח העצם הלאומי של עזר מציון. כשנפגשו לראשונה גילה לתדהמתו שהנתרם הוא אביו של חברו לנשק ששירת לצידו במילואים במהלך המלחמה
2 דקות
ד' הגיע עם אביו משה לבית אורנית של עזר מציון, כדי לפגוש את האיש שתרם מח עצם לאביו באמצעות מאגר מח העצם הלאומי של עזר מציון, והציל את חייו.
הוא לא חשב לרגע שיגלה שמדובר בפ', קצין מודיעין ששירת לצידו במילואים בימי המלחמה- ""אני עומד לפני פגישה עם מישהו שאני יודע שהולך עכשיו להיות חלק מחיי כי הוא הציל את אבא שלי, ופתאום אני קולט שאני מכיר אותו, במשך חודשים ישנו אחד ליד השני באותו אוהל, בילינו שעות יחד במשמרות בחמ""ל"". הסיפור שלא ייאמן שיכול לקרות רק בישראל.
תחילת הסיפור לפני יותר משנה כאשר אצל משה שטיינר (69) אובחנה תסמונת MDS , מחלה של מח העצם שמעמידה את החולים בה בסיכון גבוה לפתח לוקמיה מיאלואידית חריפה, סוג של סרטן הדם. שטיינר היה זקוק בדחיפות לתרומת מח עצם שתציל את חייו. לאחר חיפוש, הוא קיבל טלפון ממאגר מח העצם הלאומי של עזר מציון והתבשר כי נמצא לו תורם מתאים שייוכל להציל את חייו. ""הייתי בסכנת חיים, זו מחלה לא פשוטה, היה שלב שהתחלתי לחשוב 'טוב, אני אגיע רק לגיל 70' ובאיזשהו מקום השלמתי עם זה. כשאמרו לי שיש תורם זו הייתה הקלה גדולה"", מספר משה.
יש תורמים שמוכנים לתת מח עצם - רק חסרה הבדיקה. אתם יכולים להשלים את החוליה החסרה
הוא לא ידע אז שהתורם המיועד הוא פ' (23), קצין מודיעין בגדוד הנדסה שזמן קצר אחרי 7 באוקטובר קיבל טלפון מהמאגר של עזר מציון שהוא נמצא מתאים להצלת חיים של אדם בשנות ה-60 לחייו. פ', שהצטרף למאגר בעת הגיוס לצה""ל ב-2021 בעמדה של עזר מציון בבקו""ם, לא האמין בתחילה. ""התחילו להסביר לי הכל ורצו כל מיני פרטים. כקמ""ן אני מודע לכל הסכנות ואמרתי שאין סיכוי שזה אמיתי, אז ניתקתי להם, חיפשתי את המספר של עזר מציון בגוגל והתקשרתי בעצמי כדי לבדוק אם זה אמיתי, ואז אמרו לי שכן"".
פ' לא היסס והחל את הבדיקות לבירור סופי אם אכן יש התאמה מלאה- כאשר בסופו של התהליך התבצעה התרומה, ומשה עבר את ההשתלה בבית החולים שערי צדק בירושלים, ולאחר מספר שבועות התבשר כי ההשתלה עברה בהצלחה. בהמשך פ' השתחרר, אך המשיך בשירות מילואים במהלך המלחמה.
ע""פ הנהלים- במשך השנה הראשונה התורם והנתרם לא יודעים אחד על האחר. לפני מספר שבועות תואם המפגש בבית אורנית של עזר מציון בפתח תקווה בו פ' ומשה היו צפויים להיפגש לראשונה. משה הגיע עם ילדיו ונכדיו- ואז פ' נכנס לרגע שאף אחד לא הכין אותו אליו. ""לא ידעתי שזה יהיה כזה אירוע, אמרו לי שהנתרם ממודיעין, וגם אני ממודיעין אז חשבתי שאולי אני מכיר אותו, שזה יכול להיות מצחיק. אני ומשה התחבקנו, ואז בזווית העין אני רואה את ד' ואני בשוק. ישר התחבקנו. מתרומה למישהו אקראי זה הפך לתרומה למישהו שמכירים"".
ברגע אחד התברר שפ' הציל את חייו של ד', חברו לנשק ששירת איתו באחד מסבבי המילואים במלחמה האחרונה, כשד' משמש כרס""פ מכלול מבצעים בגדוד השריון 363. ""אני עומד לפני פגישה עם מישהו שאני יודע שהולך עכשיו להיות חלק מחיי כי הוא הציל את אבא שלי, ופתאום אני קולט שאני מכיר אותו"", מספר ד', ""רצנו והתחבקנו, זה היה מאוד מרגש, במשך חודשים ישנו אחד ליד השני באותו אוהל, בילינו שעות יחד במשמרות בחמ""ל. עברנו דרך ביחד"".
ד' תיאר את התחושה והתובנה שלו מהסיפור המדהים הזה- ""זה מה שקורה במילואים - כל אחד מרקע שונה, מהמתנחל ועד המפגין בקפלן, וכולם יושבים ביחד באהבה מאוד גדולה. במשך 300 ימי מילואים שום דבר מפלג לא צץ, ופתאום אני מבין שהדבר הזה עמוק יותר, יש פה אנשים טובים שמוכנים לעשות תרומה אדירה בשביל מישהו שהם לא מכירים"".
""היה לי חלום שיבקשו ממני לתרום, אבל 20 שנה אחר כך היה לי חלום אחר, שימצאו תורם לאבא שלי"", מספר ד' שהצטרף גם הוא למאגר בעת הגיוס בבקו""ם, ""פ' הגשים לי את החלום. בן אדם שהיה לידי עשה משהו גדול בשבילי בלי שידעתי ובלי שהוא ידע"".
הצלת חיים מתחילה בצעד אחד קטן - תרומה למימון בדיקה אחת, אולי הבדיקה שמצילה
מבחינתו של פ', שאמו נפטרה מסרטן לפני 5 שנים, מדובר גם בסגירת מעגל אישית- ""אמא שלי חלתה בסרטן שד גרורתי והרופאים נתנו לה כמה חודשים עד שנתיים לחיות, היא הצליחה לשרוד חמש שנים, טסה להמון מקומות וחיה את החיים. לעזור לחבר להציל את אבא שלו זה דבר שנוגע בלב, כי אני יודע מה חסכתי ממנו"".
ל-פ' יש גם מסר חשוב- ""זו תרומה באמת משמעותית, אבל זו גם תרומה פשוטה שלא לוקחת זמן רב, לוקח שנייה לבוא לבדוק שאתה רשום, ואם לא אז להירשם במאגר. ואם אי פעם קוראים לך אז להגיד כן, כי הזמן שאתה משקיע בתרומה הוא מזערי לעומת המשמעות של התרומה עבור אותם חולים. ככל שיהיו יותר תורמים המאגר יגדל ויהיה אפשר להציל יותר אנשים""
מנהלת ומייסדת מאגר מח העצם הלאומי ד""ר ברכה זיסר מתארת עד כמה מדובר במפגש נדיר, ""היו פה באורנית מאות ואלפי מפגשים מרגשים, אבל אני לא זוכרת מפגש כזה. קשה לתאר עד כמה הדבר נדיר שהתורם יגלה פתאום שהציל קרוב משפחה של חבר שהיה איתו מסביב לשעון במשך חודשים כשלאף אחד מהם אין מושג שהקשר ביניהם הוא הרבה יותר מקשר חברי. תחושת הסיפוק להציל אדם אחר היא עצומה, ובמקרה הזה אצל היא כפולה ומכופלת"".
כל תרומה מממנת עוד בדיקה - וכל בדיקה עשויה לגלות את התורם שיציל חיים",4584
https://www.inn.co.il/news/679929,"שני נערים נפצעו בינוני בפיגוע דריסה בגוש עציון, המחבל נוטרל",,"ערוץ 7
ביטחון
שני נערים נפצעו בינוני בפיגוע דריסה בגוש עציון, המחבל נוטרל
שני נערים נפצעו בינוני בפיגוע דריסה בצומת אל-חאדר, סמוך לכביש המנהרות שבכביש 60 מדרום לירושלים. המחבל נוטרל. אחד הנערים פונה לבית החולים שערי צדק בעיר. הנער השני פונה לבית החולים הדסה.
1 דקות
שני נערים כבני 15 ו-16 נפצעו בינוני בצהריים (שלישי) בפיגוע דריסה בצומת אל-חאדר, סמוך לכביש המנהרות שבכביש 60 מדרום לירושלים. צוותי מד""א טיפלו בהם ופינו אותם לבתי החולים שערי צדק ועין כרם בירושלים.
מחקירה ראשונית עולה כי המחבל, תושב הכפר בית פג'אר הסמוך לזירת הפיגוע, דרס ברכבו את שני הנערים שהמתינו בטרמפיאדה ואז יצא לעברם מהמכונית עם סכין שלופה. מי שניטרל את המחבל הוא אל""מ (במיל') חזי נחמה שהיה בדרכו לבקר את בנו.
האזרח שניטרל את המחבל: אל""מ חזי נחמה
שלושה מחבלים חוסלו, 72 מבוקשים נעצרו
שני מחבלי חיזבאללה חוסלו בלבנון
ישראלי נפצע באורח אנוש בפיגוע בשומרון
חובשי רפואת חירום אלי אייזנבך ודניאל אליקים, סיפרו: ""קיבלנו דיווח על אירוע דריסה, הגענו במהירות למקום בכוחות גדולים וראינו 2 נערים שנפגעו מרכב. נער כבן 15 שכב כשהוא בהכרה מעורפלת והשני היה בהכרה מלאה, הם סבלו מחבלות בראש ובגפיים ומסביבם היו מספר אזרחים שהעניקו להם טיפול רפואי ראשוני, המשכנו את הטיפול הרפואי והם פונו לבתי החולים להמשך טיפול"".
פראמדיק מד""א משה בניטה שטיפל ופינה את הפצוע הקשה הוסיף ""כשהגענו לזירה ראינו שמדובר באירוע חריג. במקום הייתה המולה ובהלה רבה, וברקע נשמעו צעקות. הבחנו מיד ברכב הפוגע -השמשה הקדמית שלו הייתה מרוסקת. סמוך לרכב ראינו את הפצועים, שני נערים שסבלו מחבלות בגופם כתוצאה מהדריסה. ידענו שעלינו לפעול במהירות. הפצוע החמור מבניהם, נער בן 15, היה מעורפל הכרה וסבל מחבלות משמעותיות בראש ובגפיים. הענקנו לו טיפול רפואי ראשוני ומציל חיים בשטח, ופינינו אותו לחדר הטראומה בבית החולים כשמצבו מוגדר בינוני-קשה. הפצוע הנוסף, נער בן 16, פונה מהמקום כשמצבו בינוני.
כוחות צה""ל שהוזעקו למקום ביצעו חסימות, כיתרו כפרים באזור וביצעו סריקות בניסיון לאתר משתפי פעולה עם המחבל.
בשל פיגוע הדריסה מחסום המנהרות סגור לתנועה לשני הכיוונים. כמו כן, צומת אל חאדר, צומת אפרת דרום וצומת גוש עציון חסומים לתנועה לכיוון דרום.
ראש המועצה האזורית גוש עציון ירון רוזנטל הגיב לפיגוע: ""למרות הדיבורים על שלום אנחנו עדיין חיים במזרח התיכון ואויבנו ימשיכו לנסות להכות בנו. ביחד עם כוחות הביטחון נמשיך להבטיח את ביטחון אנשי גוש עציון"".
לקריאת הכתבה באתר באנגלית",2182
https://www.inn.co.il/news/679927,"רשת CBS: ""חמאס נוטה להסכים להצעת טראמפ""",,"ערוץ 7
ביטחון
רשת CBS: ""חמאס נוטה להסכים להצעת טראמפ""
רשת CBS האמריקנית דווח כי הארגון הרצחני חמאס נוטה לקבל את הצעתו של נשיא ארה""ב דונלד טראמפ לסיום המלחמה. לפי מקור שמקורב למו""מ וצוטט ברשת האמריקנית התשובה עשויה לעבור למתווכות מצרים ולקטאר כבר מחר.
רשת CBS האמריקנית דווח כי הארגון הרצחני חמאס נוטה לקבל את הצעתו של נשיא ארה""ב דונלד טראמפ לסיום המלחמה.
לפי מקור שמקורב למו""מ וצוטט ברשת האמריקנית התשובה עשויה לעבור למתווכות מצרים ולקטאר כבר מחר.
מוקדם יותר אמר מקור המקורב לארגון הטרור כי התוכנית ""מוטה לחלוטין כלפי ישראל"", ואימצה ""תנאים בלתי אפשריים"" עבור חמאס: ""טראמפ אימץ את כל תנאי ישראל, שלא מעניקים לפלסטינים כל זכות לגיטימית"". בכיר אחר בארגון הטרור אמר לסוכנות הידיעות הרוסית ""ספוטניק"" כי ""ניסיון לפירוז מנשק לא אפשרי. לא משנה מה יהיו המחירים - יש עקרונות שאנשינו ברצועה לא יוותרו עליהם"".
דובר משרד הקטארי הודיע כי טורקיה תצטרף לצוות המתווכות, ומשלחת מטעמה ייפגש עם חמאס הערב.
לפי מקור פלסטיני שצוטט ב""סקיי ניוז ערבית"", בחמאס הביעו הסתייגויות חריפות מהתוכנית, וכמה ממנהיגי ארגון הטרור הגדירו אותה כ""מעין הכרזת תבוסה"". חמאס פנה לקטאר וביקש הבהרות לגבי הערובות שלא תחודש הלחימה, לוחות זמנים לנסיגת צה""ל, וכן ההתחייבות שלא יתבצעו בעתיד חיסולים נגד מנהיגי הארגון בחו""ל.",1174
